,Title,Content
0,DeMar DeRozan talks about Gregg Popovich being there for him at an extremely difficult time,
1,Gregg Popovich asks Spurs crowd to stop booing Kawhi Leonard while he shoots FT's,
2,Gregg Popovich Appreciation Post,We are lucky.
3,"[Osborne] Gregg Popovich holds Spurs' rebuild plans close to vest as Victor Wembanyama's rookie season nears home stretch. ""I don't pretend to know what we're going to do,"" said Popovich. Whether it's money in the bank or draft picks or being creative trade-wise. All those things are on the table.""","[https://www.expressnews.com/sports/spurs/article/popovich-spurs-rebuild-victor-wembanyama-18939581.php](https://www.expressnews.com/sports/spurs/article/popovich-spurs-rebuild-victor-wembanyama-18939581.php)

>Spurs coach Gregg Popovich didn't tip his hand when asked Tuesday about the team's personnel plans beyond this season.  
>  
>  
>  
>The coaching staff and front office are seeking clarity in the final five weeks of the season regarding which players from the NBA's youngest squad will be retained as part of the club's rebuild.  
>  
>  
>  
>""We all have opinions every day, coaches meet every day,"" Popovich said before watching the Spurs lose 103-101 to Houston to fall to 14-52. ""We talk about that sort of thing along with everything else. So when the season ends, we'll sit down with management and have that discussion. But whether it's a young team or an older team, every team has that discussion. Changes are made every year. That just goes with the territory.""  
>  
>  
>  
>The Spurs, who will miss the playoffs for a club-record fifth straight season, are looking closely at how several players on the roster fit with rookie star Victor Wembanyama. The 7-foot-3 center is the franchise cornerstone after the Spurs drafted him No. 1 overall last June following their lottery win.  
>  
>  
>  
>With Wembanyama the favorite to win rookie of the year, Popovich was asked if the 20-year-old Frenchman's rapid development has sped up the team's rebuilding plans.  
>  
>  
>  
>""I don't pretend to know what we're going to do,"" said Popovich, who also serves as the club's president of basketball operations. ""We have a lot of possibilities ahead of us, whether it's money in the bank or draft picks or being creative trade-wise. All those things are on the table. But aren't they for every team? I don't know why we're any different. We're just younger.""  
>  
>  
>  
>One thing is certain: Popovich and general manager Brian Wright don't expect to feel any pressure from Spurs managing partner Peter J. Holt.  
>  
>  
>  
>""If your organization is unable to understand that rebuilding takes time, then you just never get there,"" Popovich said. ""We’re fortunate because we’ve always had under the leadership of the Holt family the ability to do what we think has been best. So we’re always grateful for that.""

&#x200B;"
4,[The Ringer] Gregg Popovich will have a hard time keeping Stephon Castle off the floor.,"One of the pleasures of being an NBA elitist is getting the chance to introduce fresh new faces to the broader basketball world, so let me be the first to report that *Stephon Castle is pretty awesome.* There was simply no way to know this about one of the best players on the best team in college basketball last season because the only true crucible is summer league—the purest version of the game, spared from distractions like order and game plan and on-court chemistry. We can see the truth of Castle’s game in a glorified AAU tournament and, better yet, the single game of a glorified AAU tournament, before Castle withdrew from competition in Vegas with a wrist injury.

But what a game it was. Even in the summer league slop, Castle is an engine for intuitive, winning plays, connecting dots that lesser prospects wouldn’t see and manifesting plays that lesser athletes couldn’t create. The questions about Castle’s shot and position are inevitable, but those are almost beside the point; what’s most striking about watching him play against quasi-pros is realizing how difficult it will be to take him off the floor in the earliest days of his career. Why would the Spurs deprive themselves of a guard who comes by impact plays so naturally? Throw Castle into the mix and see what he can turn up, whether by jamming opponents up at the point of attack or slicing his way through the defense. Toolsy, theoretical players are fun and all, but so are the dudes who make shit happen almost incidentally, as if it were an entire way of life. —*Rob Mahoney*

[https://www.theringer.com/nba/2024/7/15/24198860/nba-summer-league-2024-las-vegas-reed-sheppard-alex-sarr](https://www.theringer.com/nba/2024/7/15/24198860/nba-summer-league-2024-las-vegas-reed-sheppard-alex-sarr)

Pop also said similar thing himself : “He’s gonna be a quick study I think and get to play on the court quickly.”

I do think he has pretty good chance to start beside CP3, like what SGA did at OKC. It's not uncommon for Pop to bench a player of Harrison Barnes caliber and make him lead the bench too."
5,Gregg Popovich explains why he told the crowd to stop booing Kawhi Leonard,
6,'A Good Sign': Why Gregg Popovich's 1st Year Coaching Victor Wembanyama Was A Silver-Lining Success,"Not that we don't already know about much here, but the culture-building looks set to continue. Pop will probably have to lead a round of cheers for Wemby soon after his cheers for Timmy. "
7,"[HoopsNostalgia] ""There's no NBA tonight, so here's a photo of Gregg Popovich putting one down (in a pair of Chuck Taylors) during a game for his HS team the Merrillville Pirates (1966).""",
8,"Spurs, Gregg Popovich are committed to building a contender. ",
9,Gregg Popovich Is About To Do It Again...,Another One!!!!!!
10,"Gregg Popovich on Stephon Castle:

“He’s gonna be a quick study I think and get to play on the court quickly.”",
11,"""Gregg Popovich worked with Victor Wembanyama on positioning, footwork & movement on the block""",
12,"Mike Finger (@mikefinger) on X: The last time the Spurs fell to 3-15 to start a season was December 8, 1996. The coach was then fired. By Gregg Popovich.",
13,Spurs fans are turning on Gregg Popovich over Victor Wembanyama 'mismanagement',
14,ESPN's Stephen A. Smith rips Gregg Popovich over resting players,
15,Zach Collins Tells A CRAZY Gregg Popovich Story,Feeling very relevant for the big fella right now
16,"[Throwback] Manu Ginobili memories: Gregg Popovich, Steve Kerr, more Spurs share best moments | NBA on ESPN",
17,"“This year, with development I think one of the important factors, to enhance that development, is winning. Winning is as important this year, as learning was in the past.” - Gregg Popovich on Media Day","Back on Media day, Gregg Popovich was asked:

There have been times in this building on Media day, where it was championship or bust, and then last year you said it was about developing these guys until you could pass them on to the next guys. You said you wanted to make them pros. After the draft of a certain player (Wemby), does that change the expectations going forward? What would reasonable expectations be? 


If you watch that video (the question and answer I’m talking about start at 10:51), I think Gregg Popovich tells us what we should expect this season and some of you may not like it:


“It’s pretty inherently obvious we wanna win”

“Adding more wins is appropriate, mandatory, helpful.”


I think PATFO will not waste any time they have with Wemby like other bumbling organizations would.

While they may not be expecting to win a championship this year, I also don’t think this is just another ‘development’ year and we just got to let the young guys develop and not expect better. 

The spurs know they have a generational talent in Wemby, and this season is all about seeing who can swim next to Wemby and who will sink."
18,2023-24 San Antonio Spurs Season | Gregg Popovich Post-Game Interview 12.26.2023,Good post game interview with Coach Pop. Questions how the hammer is coming down the next few games. Touches on Victor’s health as well.
19,"Pop has a message for you : « Those who think things should go faster, or don't understand that we don't win every game... That says more about them than it does about basketball. »","Great interview to French newspaper L’Equipe, about rebuilding, trades, Victor, Vassell, etc. 

Original here https://www.lequipe.fr/Basket/Article/Gregg-popovich-san-antonio-on-ne-peut-pas-sauter-les-etapes/1446940
Translation here https://pastebin.com/66i99HCw

Read it."
20,"After Phil Jackson, Shaq’s Agent Says Greg Popovich NBA’s “Last Respected Coach”, Thinks JJ Redick Should Take a Cue","
 “These star athletes can look at most coaches and say I make more than you, I know more than you. You can’t tell me anything. And by the way, if I don’t like you and the team doesn’t get rid of you, I’m going to go somewhere else. Phil Jackson might be last of the Mohicans and maybe Gregg Popovich.” "
21,Jeremy Sochan opens up on his struggles,"[Spurs' Jeremy Sochan opens up on his struggles to shift to point guard](https://www.expressnews.com/sports/spurs/article/spurs-jeremy-sochan-opens-struggles-shift-point-18485472.php)

  
Re-iterating he was committed to making the position change work, Sochan after practice Saturday acknowledged the move to point guard the shift has taken on him

&#x200B;

 

There have been times during Jeremy Sochan's second NBA season in which he wishes he could go back in time.

He doesn't want to be a rookie again. He just wants to be a power forward.

That experiment as a Spurs point guard?

""There have been moments where it's like, 'Yo I don't want to,' "" Sochan said Saturday. ""It's like (expletive) this (expletive).""

Spurs coach Gregg Popovich has called the move of the 20-year-old Sochan from power forward to point guard the team's ""official experiment of 2023-24.""

Occasionally, that experiment has produced positive results. Occasionally, it has blown up in everyone's face.

This is to be expected.

""It is the first time I have ever played point guard in my life,"" Sochan said.

Re-iterating he was committed to trying to make the position change work, Sochan after practice Saturday acknowledged the toll it has taken on him.

""I am going to be honest,"" Sochan said, ""there have been moments where there isn't confidence.""

On the flip side, Sochan said, ""There have been moments of being confident.""

The 6-foot-8 Sochan experienced both sides of the spectrum in Friday's 117-110 loss to Minnesota. He committed a season-high six turnovers, including four in the first half.

He also contributed 14 points, seven rebounds, five assists and three steals, all while being asked to guard Timberwolves' All-Star Anthony Edwards.

As the Spurs attempted to come back from 18 points down, Sochan swished a key 3-pointer and found an open Tre Jones on a skip pass for another big bucket.

In nine games as the Spurs' starting point guard, Sochan is averaging 9.9 points, 5.4 rebounds and 4.7 assists. He has been one of the club's best defenders, and is tied with Victor Wembanyama for the team's lead in steals at 1.1 per game.

""I am making a transition like this in the NBA, which is rare,"" Sochan said. ""You don't see a lot of people going from power forward to point guard.""

Popovich and the Spurs' staff have been unwavering in their commitment to Sochan to start the season. He says he has also gotten support from Jones, last year's starter who is now coming off the bench.

""It means a lot,"" Sochan said. ""If you didn't have that side, it would be a lot harder. It feels good that everyone in this building believes in it, and they know that it is not always going to be perfect, but they are there for it."""
22,Pop on Wemby and Coaching.,
23,Josh Richardson on one of Pop's rules,
24,Pop has done nothing since Tim (more in comment),"Gregg Popovich has done a great job since Tim Duncan, since he appointed himself as a coach.

He's done a great job to build a team around Tim, he liked the non ego thing, and it was the thing for Duncan too who backed up his coach.

Maybe it's why Pop chose non-american players, happy to play in NBA, less ego.

Since Duncan left, Pop always said he would have resigned, but he didn't. And since then, well, it has gone downside.

Kawi, Lamarcus, all wanted to leave asap.

Pop was Duncan area: since then, he has not retained any good player. Now Wemby is questionning his coaching, subbing himself.

&#x200B;

Maybe it's time to have the question.

&#x200B;

Edit : Sorry for all the people who downvoted me for speaking my mind, let me be clear : Pop did an oustanding job to keep a team around Tim all these years and win these championships.

But he has done nothing since Duncan retirement. He began with him and should have retired with him like he intended to  (or better, change position in the organisation, he has a lot to offer, maybe not as a coach anymore, and if coaching is tanking for his remaining years, it's not something I wish for him nor do I want that to be his last legacy).

Edit 2 : I was downvoted to hell for a post saying Vic subbed  himself, for stating a fact even him admits.

You are a cult, you are closed to outsiders (I'm french and a long term Spurs fan), and I'm a fan of many sports, never have I seen so closed minds where every critic is considered an attack against the dogma (don't criticize royalties).

Thanks to some who had constructive criticisms against my views and I learned from them."
25,For those that like to read former Spur Demar Derozan is releasing his memoir on September 10th. Foreword by Coach Pop 📖,
26,They still want to play for Pop 🔥,
27,Victor Wembanyama Keeps Losing. The NBA Is Still Terrified.,"The San Antonio Spurs are unequivocally one of the worst teams in the NBA. They’ve lost more than three times as many games as they’ve won. They’re one of only two teams mathematically eliminated from the playoffs. They’re on pace to finish dead last in the Western Conference for the second year in a row.

But to the biggest names in the NBA, the Spurs don’t look like doormats. They look completely terrifying.

The reason is a 7-foot-4 phenom from France who puts his phone on airplane mode at 9 p.m. to read before bed.

Victor Wembanyama hasn’t merely lived up to the hype that followed him across the Atlantic in June, when he was the most heralded No. 1 draft pick since LeBron James. He’s convinced the NBA’s best players, including James himself, that he’s ready to take over the league—and sooner rather than later.

“He doesn’t have a ceiling,” James said of Wembanyama, who is still just 20 years old. “He can do whatever he wants to do with his career.”

James made his comment after the rookie stuffed every category of the stat sheet against the Los Angeles Lakers: 27 points, 10 rebounds, eight assists, five steals and five blocks. 

Wembanyama had also tallied five steals and blocks the game before, becoming the first player to reach that threshold in back-to-back contests since another heralded young star did so in 1987. His name was Michael Jordan.

Wembanyama plays nothing like James or Jordan. In many ways, that’s the point. He plays like nothing like anyone who has come before him. 

The rest of the NBA has spent this season getting accustomed to a giant who, under the guidance of legendary coach Gregg Popovich, collects new skills as easily as he changes a lightbulb. He shoots 3-pointers more often and with a higher hit rate than either James or Jordan did as rookies. With his 8-foot wingspan, he dunks from more outrageous distances. And his defense is already in a class of its own: Wembanyama leads the NBA with 3.4 blocks per game and is in the running for the Defensive Player of the Year award.

Wembanyama’s statistics tell only part of the story. The NBA’s superstar class tells the rest. A kid who can’t yet legally partake of Popovich’s famously refined wine selections simply shouldn’t be doing the things he’s done, says the list of icons who have lately gone up against him.

In January, Wembanyama had a bruising back-and-forth with Giannis Antetokounmpo of the Milwaukee Bucks, at one point rejecting the two-time MVP’s shot. At All-Star weekend in February, Antetokounmpo licked his wounds and offered praise.
“There’s never going to be anyone else like him,” said the 6-foot-11 Bucks star. “People don’t understand. He’s like 7-5. I was standing next to him. He’s way, way, way taller than me. He can shoot, he can dribble—blah, blah, blah.”

The problem for the Spurs is that the lousiness that let them win last year’s draft lottery and land Wembanyama hasn’t lifted. None of his teammates has appeared on so much as a single All-Star roster, meaning Wembanyama’s performances often feel like scintillating trailers for a yet-to-be-released blockbuster. According to Player Efficiency Rating, Wembanyama is already the 14th-most valuable player in the entire NBA.

The next-closest Spur? Devin Vassell. He was 82nd on the list, entering Saturday.
In an odd way, the lack of help on the roster has only underlined Wembanyama’s bona fides. Opposing defenses focus their game plans on stopping him, and still he has burst right through the fabled “rookie wall,” scoring nearly four more points per game after the calendar flipped to 2024 than before.

“He’s got a target on his back. They’re going to come after him, they’re going to be physical,” Popovich said, adding, “He’s learning every night.”

Only one person in professional basketball, it seems, is unimpressed by Wemby’s rookie season. That would be Wemby himself. 
After matching Jordan’s defensive feat, he wondered if Jordan’s numbers came in victories or defeats. He hoped he could “look back and think this is a good performance,” he said. “As of today, I can’t be satisfied with a loss.”

The players who have spent a generation gobbling up championships are quite certain he won’t have to be satisfied with losing for much longer, as he matures and the Spurs build around him. In the meantime, those established stars appreciate their good fortune to be playing now, not later.

“It’s just insane how dominant he’s going to be as he gets more comfortable in the game,” 35-year-old Phoenix Suns star Kevin Durant said last month. “Luckily, I’m on my way out, so I won’t have to deal with it too much.”"
28,NBA free agency: Teams that could make big offseason moves | Bobby Marks,"[https://www.espn.com/nba/insider/story/\_/id/40292219/2024-nba-offseason-sleeper-teams-free-agency-make-big-moves-soon](https://www.espn.com/nba/insider/story/_/id/40292219/2024-nba-offseason-sleeper-teams-free-agency-make-big-moves-soon)

Not much here but I thought you might want to read the Spurs portion of this paywalled ESPN+ article.

**""I don't pretend to know what we're going to do. We have a lot of possibilities ahead of us, whether it's \[having\] money in the bank or draft picks or being creative tradewise. All those things are on the table. But aren't they for every team? I don't know why we're any different. We're just younger.""** *-- coach Gregg Popovich, March 2024*

Reigning Rookie of the Year [Victor Wembanyama](https://archive.ph/o/rPTBC/https://www.espn.com/nba/player/_/id/5104157/victor-wembanyama) puts the Spurs in a different category than most of the teams on this list.

Year 2 of the Wembanyama era begins in San Antonio with a heightened awareness that winning 22 games and finishing at the bottom of the Western Conference is not acceptable with a player of his caliber on the roster.

How the roster improves will come down to whether management is willing to accelerate the rebuild this offseason and not next summer, when the Spurs could have up to four first-round picks and $50 million in cap [space. ](http://space.One)

One scenario in which San Antonio could improve now but not strip its flexibility is to sign veteran point guard [Tyus Jones](https://archive.ph/o/rPTBC/https://www.espn.com/nba/player/_/id/3135046/tyus-jones) and then look to trade for Pelicans forward Brandon Ingram.

A starting five of Jones, [Devin Vassell](https://archive.ph/o/rPTBC/https://www.espn.com/nba/player/_/id/4395630/devin-vassell), Ingram, [Jeremy Sochan](https://archive.ph/o/rPTBC/https://www.espn.com/nba/player/_/id/4610139/jeremy-sochan) and Wembanyama, along with two first-round picks in the top eight (if both are kept), is a strong foundation to build on.

**Trade we would like to see:** [Keldon Johnson](https://archive.ph/o/rPTBC/https://www.espn.com/nba/player/_/id/4395723/keldon-johnson), [Zach Collins](https://archive.ph/o/rPTBC/https://www.espn.com/nba/player/_/id/4066650/zach-collins), 2025 Chicago first (top-8 protected), 2027 Atlanta first (top-5 protected) to New Orleans for Ingram

**Starters under contract:** Jones, Vassell, Sochan, Wembanyama and [Keldon Johnson](https://archive.ph/o/rPTBC/https://www.espn.com/nba/player/_/id/4395723/keldon-johnson)

**Reserves under contract:** Collins, [Malaki Branham](https://archive.ph/o/rPTBC/https://www.espn.com/nba/player/_/id/4565201/malaki-branham), [Devonte' Graham](https://archive.ph/o/rPTBC/https://www.espn.com/nba/player/_/id/3133601/devonte-graham), [Julian Champagnie](https://archive.ph/o/rPTBC/https://www.espn.com/nba/player/_/id/4592479/julian-champagnie), [Blake Wesley](https://archive.ph/o/rPTBC/https://www.espn.com/nba/player/_/id/4683935/blake-wesley), [Sidy Cissoko](https://archive.ph/o/rPTBC/https://www.espn.com/nba/player/_/id/5081727/sidy-cissoko) and [Charles Bassey](https://archive.ph/o/rPTBC/https://www.espn.com/nba/player/_/id/4397886/charles-bassey)**Free agents:** [Cedi Osman](https://archive.ph/o/rPTBC/https://www.espn.com/nba/player/_/id/3893016/cedi-osman), [Dominick Barlow](https://archive.ph/o/rPTBC/https://www.espn.com/nba/player/_/id/4870562/dominick-barlow) and [Sandro Mamukelashvili](https://archive.ph/o/rPTBC/https://www.espn.com/nba/player/_/id/4278580/sandro-mamukelashvili)

**Incoming first-round picks (13):**

* ▪The No. 4 and No. 8 pick in the 2024 draft
* ▪All seven of their own, starting in 2025
* ▪Two unprotected from the [Atlanta Hawks](https://archive.ph/o/rPTBC/https://www.espn.com/nba/team/_/name/atl/atlanta-hawks) (2025 and 2027)
* ▪2025 top-14 protected from the [Charlotte Hornets](https://archive.ph/o/rPTBC/https://www.espn.com/nba/team/_/name/cha/charlotte-hornets) 2025
* ▪Top-10 protected from Chicago (top-8 protected in 2026 and 2027)

*Swap rights: Atlanta (2026),* [*Boston Celtics*](https://archive.ph/o/rPTBC/https://www.espn.com/nba/team/_/name/bos/boston-celtics) *(2028, top-1 protected) and* [*Dallas Mavericks*](https://archive.ph/o/rPTBC/https://www.espn.com/nba/team/_/name/dal/dallas-mavericks) *(2030)*"
29,What do Spurs fans think of my all time Spurs roster?,"For fun, over the last few years, I’ve written all time NBA Rosters.

I have over 240, and 1 for every team.

I wanted some Feedback from you guys, on the Roster.

Just to note, I am not a spurs fan.

Also, I will not be taking guys who played for San Antonio, out of their primes, so No T-Mac, Moses Malone, or Dominique Wilkins.

Here is the roster.

Point Guard. Tony Parker

Shooting Guard. George Gervin

Small Forward. Kawhi Leonard

Power Forward. Tim Duncan

Center. David Robinson

Bench.

Point Guard. Avery Johnson/Alvin Robertson

Shooting Guard. Manu Ginobili/Danny Green

Small Forward. Sean Elliot/Bruce Bowen

Power Forward. Robert Horry/Larry Kenon

Center. Lamarcus Aldridge/Artis Gilmore

Coach. Gregg Popovich 

2 snubs who were almost on the list, are Demar DeRozan, in replace of Danny Green, and Wemby, in replace of Gilmore

Please share feedback, and potential suggestions.

Edit: I have replaced Dennis Rodman, for Larry Kenon."
30,Wemby out for the rest of the season ? (French Media),"French newspaper (local but largest in distribution) [Ouest-France suggests](https://www.ouest-france.fr/sport/basket/victor-wembanyama/nba-laisse-au-repos-face-au-thunder-victor-wembanyama-pourrait-ne-plus-rejouer-cette-saison-5aa0d51a-f7eb-11ee-b61a-805a85d39d9d) Wemby might not play until the end of the season. No particular insight but that's how they analyse Pop's latest press conference and the fact that Vic finished his latest game with a slight pain at the ankle.

https://preview.redd.it/jj8a2a13xutc1.png?width=884&format=png&auto=webp&s=11b85a261f9905c5e20cdbf902d3434567c7d789"
