,Title,Content
67,The Spurs aren’t pressing to be good next year (and that’s ok),"The Spurs want to build a consistent championship level team.

This squad right now is nowhere near that goal. Yes, we *want* to start winning more than we did the last 2 years. What are the best steps toward **championship contention** though?

Make short term moves like trading for a rotation shooter, sign KCP to a big contract, and maybe we could make the playoffs as soon as next year. However, we still have 3 non-big rotation players nobody on the other team is going to guard. Most Spurs fans don’t want to trade 2 of them (Castle/Sochan). The Spurs could push some chips in and turn this into a playoff team right now, but there is no practical or well-advised way of turning this team into a championship level team next season.

The Spurs want to win championships, and they can’t do that next season. A cold analytical conclusion then is the result of next season, whether we’re a play-in team, playoff team, lottery team, the point is moot from a roster building perspective; not for fans and players which I’ll get back to. If the Spurs want to win championships (and they can’t do that next season) their short term goal should be doing everything they can to maximize their eventual championship-vying window. How can they do that?

**Trading for future draft assets. They did that last season, last night, and I expect them to do it again in the coming weeks.**

Don’t get your hopes up for trades/signings meant to improve the roster in 2025. When the new league year starts, expect the Spurs to take on more bad contracts and stockpile even more draft assets. They aren’t ready to compete now, so they should be using cap space to grow their stockpile even further.

That stockpile will eventually be used. Ideally, some of your own recent draft picks like Sochan Castle and a 2025 draft pick turn into the next Manu or Kawhi. Then you hold onto all your draft assets and continue to stack young cheap production onto championship vying Spurs rosters. That’s unlikely you end up with a Manu or Kawhi level player. More likely, these assets are traded for a star player to be determined at a later date.

**Q: So the Spurs are just going to tank again?**

No. I don’t think the Spurs wanted to lose last year. They were just a bad team whose front office cared more in the 2023 offseason about adding future draft picks and holding cap flexibility than they did winning. That is probably going to be the same this offseason.

They don’t want to lose games anymore, but given the choice of getting a player that makes them a little better right now, and a long term draft asset that can be used in a multitude of ways in the future, they’re going to choose the draft asset. If that results in the Spurs being one of the worst teams in the league, so be it. That’s not the goal but since we can’t contend for a title the goal short term isn’t even about winning. The goal is accumulating more assets for when we do shift to trying to win a championship.

**Q: How long can this go on? When do we shift to trying to win?**

Brian Wright has said the players will dictate that. In my opinion, if next season goes anything like this season did, you don’t even bother to ask Victor if he’s feeling impatient. If we finish with a similar record next season as we did this season, I think it’s immediately time to accelerate to more of a win-now mode and stop accumulating future assets. This approach the Spurs have operated with the last year (and should do again this year) cannot go on any longer than 2025. There is no moving the goalposts back. We have to start trying to win after next season. 2 lottery ending seasons to start Victor’s career is not unacceptable. 3 would be.

**Q: Why not trade for a star now?**

I don’t see the guy that’s worth cashing out the assets. If they got Lauri or Darius or Trae cheap that’s one thing, but I don’t think any of them are going to be cheap. None of them are the white whale type the Spurs would really prefer to go after either. Outbidding other teams with a stockpile of assets will be an issue, but you’ll have to hope the player prefers to be in SA with Victor rather than OKC, HOU, UTA, etc. and helps alter his trade destination. 

**Q: So for real, this means the Spurs are going to tank again this year?**

No, I really don’t think the Spurs want to finish with a record like they did the last 2 seasons. Even if the top of the 2025 draft is enticing. If they do finish with that bad a record the consolation would be the lottery and prizes at the top of the lottery. Everyone is hoping the Hawks can somehow do that for us.

I think the Spurs want to win as many games as they can next year, but they’re not going to be super proactive in trades and FA to meet that end. The front office is going to firstly try to accumulate more assets, *try* to get some shooters in doing that, but the priority will not be improving the 2025 roster. The 2025 Spurs players and coaches are going to try to win but they’re going to have to do it without the benefit of a front office that cares a ton about how much they win in 2025.

With an improved Wemby, and an improved understanding of how to maximize his skills, I think we will win more games next year even as the roster is totally unoptimized to win short term. We played around a 40 win pace when both Tre and Victor started. Almost nobody on the team improved last season. The optimist in me says some guys will improve this year, even if it’s just 1 or 2, and we can fight for the play in next season.

I’ll be rooting for the Spurs to make the playoffs next season. I think all the players and coaches are going to fight to do that, but the front office’s job is to put us in the best position to compete for championships. The best way they can do that is by stockpiling assets this summer. Now is not the time to push any chips in."
68,"Juan Nunez is completely cool with being stashed, knows the importance of his development. His quote ""I'm a creative player, I like to make my teammates better, That's me"". Looks like another Spur in the making","Brian Wright loves this kids and is completely sold on him.

His quote ""You want to find hard workers,"" Spurs general manager Brian Wright said. ""(Players) that care about the game. Over time, those are the ones that improve. You have to put the time in; put the work in. You can't just fast-forward to the end to know the exact outcome, but you can bet on the ingredients.""

And another one ""He's a really, really talented point guard,"" Wright said. ""Probably the best pick-and-roll player in the draft as a passer. He's tough, he's got moxie, he's competitive and he's a winner."""
69,"[Haynes] Tobias Harris I'm told is expected to have ample interest from multiple teams. Utah, Detroit, San Antonio, Dallas, and New Orleans. Dallas and New Orleans, those would probably have to be S&T scenarios. I don’t see a scenario where Tobias would be back with Philly, I can say that for sure.",
70,We're definitely signing or trading for a shooter soon,"Not some big-time all-star of course, but a decent roleplayer probably. Last season, we had Doug and Cedi as our vets that were our 3 point shooters. We currently have nobody who can shoot the 3 at league average level (or above) besides Devin and Julian now.

Brian Wright himself said shooting is a concern right now. I don't know, just seems like the team is definitely incomplete now. Even compared to last year on paper when (we thought) we had spacing covered. Now on paper, you can EASILY see it's glaring weakness. 

And unlike some people on this sub, I don't see the front office and Pop not wanting to address this issue in free agency as they would very likely feel that is counterproductive and harmful, especially for a development or ""tanking"" season. The Pistons currently have more players that shoot league average or above league average from 3 than the Spurs when you compare their lineup and our lineup (Isaiah Stewart, Simone Fontecchio, Cade Cunningham, and Marcus Sasser compared to just Devin and Julian. We seriously can't have that."
71,The Spurs equipment manager has been putting in work this morning,
72,So it's pretty much a given that we're trading for SOMEBODY who can shoot this season right?,"I understand we're entering another development year, but there is no way you can go into next season with this roster and it's spacing issues. Brian Wright even said that we need to prioritize spacing because we were one of the worst shooting teams in the league. This basically says we are trading for SOME kind of shooter this off-season. Whether it's a roleplayer or bigger name. Who do you think it'll be?"
73,"[Adrian Wojnarowski] ESPN Sources with @TimBontemps: The Sacramento Kings are agreed on a sign-and-trade that will land DeMar DeRozan on a three-year deal, send Harrison Barnes to the San Antonio Spurs and Chris Duarte, two second-round picks and cash to the Chicago Bulls.",
74,Just don't get cute with #4,"Take a look at the previous #4 picks the past 25 years. https://www.statmuse.com/nba/ask/4th-overall-draft-picks-nba 

There's generally a consensus top 5 of Sarr, Risacher, Topic, Dillingham, Castle. So long as Brian Wright doesn't reach for someone with the 4th overall pick we should at least be getting a solid contributor. If we really knock it out of the park, it's potentially a HOF level player like Bosh or Paul. 

Tldr; take the best player available at #4"
75,Wemby is playing at an all star level!… do we make moves?,"Lighting a fire today. I seen this throughout the subreddit so let’s speak on it!

Do we make trades to compete as soon as possible or do we develop more and build through the draft? 

Let’s drop some stats. 

[Wemby is playing at an all star level statistically speaking](https://twitter.com/the_bball_index/status/1747242299438883313?s=46) 

[He takes the 4th hardest shots amongst bigs in the league](https://twitter.com/the_bball_index/status/1745430365265621009?s=46) 

But at the same time 
[Wemby is the only big that ranks in the 95th percentile across blocks, steals and deflections.](https://twitter.com/the_bball_index/status/1745792747687248369?s=46)

He is a [top ten forward](https://twitter.com/the_bball_index/status/1746306134170816539?s=46) and [a top ten mobile big](https://twitter.com/the_bball_index/status/1747351767246069964?s=46) according the D-Lebron stat. A stat known to encompass majority of impact factors and stats. 

[He is the third best differential of players shooting worse when being defended by Wemby for more than 10 shots](https://twitter.com/spurs_nation/status/1747662649981026810?s=46)

[He is also the number one rookie in the D-Lebron stat as well.](https://twitter.com/the_bball_index/status/1747400337986891955?s=46)

[Over his last 8 games he ranks second in the NBA for efficiency per minute behind Embiid.](https://twitter.com/nba_university/status/1747257860474720334?s=46) 

He’s in the top 40  in the NBA for points per game, leading the league and blocks per game, leading the league in blocks+steals, top 10 in rebounds. And put out a number historic performances. He also has put up 30pts against AD, 27pts on giannis on a minutes restriction, and 22pts against jokic in 25 mins before the minutes restriction. 

Now knowing all this, we had expectations of Wemby being generational… not sure how many of us predicted a borderline all star and defensive player of the year in his rookie year.

Since Wemby is ahead of schedule should we push faster to build around Wemby and surround Wemby with competitive talent and use our draft picks for proven talent to maximize our window to compete or do we build through the draft and develop our talent so that our supporting talent develops as well and do smaller trades to round out the roster.

Pros - Wemby being an all star talent already and adding more of similar more proven talent can have his competing in playoffs giving him early experience he can use for his career allowing him to compete at the highest level for longer as our best player. It seems we are starting to see a winning formula as of late but the supporting cast seems several years away from that. We can expedite the process through strategic trades.

Cons - Wemby still hasn’t have a reliable jump shot, struggles with heavy contact and has a questionable motor. He still can use a stronger base so he doesn’t get pushed around by heavier bigs and forwards. He hasn’t gone through the adjustment from season to season and this summer he will be competing for France so it’s not likely he will do an extremely large jump between this year since he won’t be working on his craft the entire summer compared to other players not competing. Also it is a risk to have him compete. To extend his career precautions should be made. 

What do we think? It’s been said across the subreddit? If Wemby is playing at this level now do we wait until he rounds out his issues and get more experience or seeing how he plays now, we start to push to get to a competitive playoff level and maximize Wemby’s window? 

I already know how I feel but since others have been discussing around it why not bring it to the forefront.

Thoughts?"
76,I’m crushed. Someone please help me cope with what we just did. ,Please I just need someone to convince me that Dilly would’ve been a bust and that we’re better off trading for someone born in 2012. 
77,"A better idea than tanking (tamper, don't tank) ","I've seen a lot of buzz lately about the Spurs potentially tanking, specifically trying to get Flagg or Traore.

 Truthfully I don't think it's worth it for Flagg anyway. Traore fills a much bigger need and is an absolutely perfect fit with Wemby and has a massive superstar ceiling. Flagg is still the better prospect but there's diminishing returns for his skills given how much overlap it has with Wemby. If by some miracle the Spurs landed #1 in the lottery it would be better for them to trade down to #2 and still land a likely superstar in Traore. Teams would give up super high value assets to move up from #3/#2 to #1 for Flagg. Traore + big assets for #1 is a perfect scenario for Spurs but incredibly unlikely.

In reality, we have to ensure that the future is not decided by a random lottery. There needs to be a guarantee. 

So the true path forward is not to tank for Traore/Flagg. The true path is to TAMPER instead of TANK. 

Here is the roadmap: 

1. Traore gets drafted by some pathetic shit organization like the Pistons/Hornets/Wizards whoever. 

2. Traore stays with them for 2 years, meanwhile Wemby constantly texts/calls/sexts with him behind the scenes and plays up their French chemistry and becomes his best friend when they link up with the national team. 

3. Traore knows deep down he doesn't wanna waste his career in a dumpster like Hornets/Wizards/whoever, and starts demanding a trade as soon as he can. 

4. Traore either forces them to trade him after year 3 or they can let him walk after year 4. Spurs can pay his extra salary that he would've been eligible for with his draft team through some combination of money laundering under the table and hooking him up with the croissant sponsorships with Wemby. 

5. Spurs get a young but developed Traore right around when Wemby is in his prime and the dynasty begins. 


If you've read this far, you know that this is the correct path forward. Yes, I am a genius. Yes, I should be GM in place of Brian Wright. 


TL/DR: Tamper for Traore, don't tank. 



"
78,What are the flaws that are causing this losing slump?,
79,Rob trade was highway robbery ,Can’t wait to get our next super star in 2031 with another 1st pick 
80,Wemby going back to Tre Jones after spending time with Trae Young,
81,At risk of getting hate I have to ask- Does anyone else still have a bad feeling about how the Spurs handled the Primo situation given the reported timeline of events? Specifically our GM knowing for months yet keeping Primo protected,"I waited for all the reports about what actually happened and what I’ve gathered is that Primo was constantly showing his P**** to the victim over the course of months and early on she told the spurs front office and our GM did nothing. Reportedly just asked to keep it under wraps and keep seeing primo and then avoiding her request for a meeting and some sort of action to be taken. Reportedly she kept asking if Pop knew and was told he DID (but she did report she thinks she was being lied too about that part) All the time Primo continued to expose himself to her and this was all known at the very least by Brian Wright yet he not only didn’t do anything but also kept pushing for Primo with a contract and making him the face of the Spurs marketing campaign with Self. And it wasn’t until after he exposed himself to members of the hotel staff that any action was taken (and it’s implied this was only done because it involved victims out of the spurs control) after all this Spurs throw money at her and cut Primo but allowed Brian Wright and the entire front office that was involved and knew about the situation to keep their jobs and continue like nothing happened? / I was hoping this was all just a misunderstanding but the spurs just throwing money at her and then acting like nothing happened in regards to the GM and front office knowing for months left me with a really sour taste about everything. I always loved that our team and organization was known as the 1st class no nonsense team that does stuff the right way and values morals and high character yet nothing was done other than the bare minimum in cutting the player they could protect. Adding on to the weirdness they hire her back on???? Reports were this was essentially a form of insurance for them and her so that she receives continued $$$ with the expectation she doesn’t discuss anything about this anymore. Essentially paying for her continued silence. 

I love the team love our player and love everything we stand for which is what makes this reported timeline so strand and disheartening. I’m still hoping there’s going to be some update making this make sense because as it stands out FO and GM look REALLY bad."
82,"Spurs may have something up their sleeve says this article, I kinda agree","It essentially tells us these 3 things

1) The Spurs' savvy move will make a quicker impact than people expect.

2) This is not a move that kicks the can down the road for the Spurs.

3) GM Brian Wright has attempted to communicate their intentions with clarity without giving away the game plan"
83,Forward thinking…. Maybe?,"Being an NBA GM is like working through quantum entanglement. For every decision you make multiple outcomes are possible and each possibility has multiple unforeseen consequences. When the Spurs lost Leonard who could have foreseen  us getting wemby all these years later. If we had taken the lakers offer back then we could be the pelicans today. 

All this to say, maybe there is a good reason not to draft a pt guard. Stay with me here. I don’t like the idea of drafting for need, and I wasn’t sold on Topic, but if you want to talk maximizing value then maybe Topic with the best possible outcome is an all star lever point guard in 5 years. In this outcome he would certainly have more value than picks in 30/31. With salaun off the board I immediately thought Topic would be the pick. It stung even more to see OKC get him. 

In an alternate city on the other side of the country could be my reason not to draft Topic. In the age of the second apron, Boston is sitting at a $190 million cap. They don’t need to make any big decision till next yr but looking off in the distant future I see Horford retiring after next season and Tatum has 2 years left on his contract. Basically the money crunch will force some tough decisions. Where the spurs become entangled is White has 1 more year on his contract. Boston has to keep Tatum and replace Horford in the second yr of being in the second apron. Boston can resign White if they want to but the penalties might be too much. The Spurs could simply let it play out and use their cap space to sign him after next yr. If they make a big offer I would think we would be his first choice. The other option is to be more proactive. Make Boston an offer. Show them the inevitability of it all. Maybe Chicago’s pick would do it. It might be a little rich knowing he will be a free agent but it would get the job done. Can you imagine a more perfect outcome for the Spurs? White is tailor made for playing with Wemby. He can run the pick and roll at an all nba level. He can play off ball. He can space the floor and defend. More importantly he is the perfect point guard for this team. Maybe Brian Wright is the GM we need after all. "
84,NBA Expansion Draft,"With the NBA set to expand in the near future, I thought this might be a fun exercise! If you were Brian Wright, which EIGHT players would you put on the protected list? You can only select players under contract or RFAs! "
85,Timberwolves Reddit is celebrating the Draft Robbery ,"Brian wright Might aswell be the GM of Minnesota now .,seriously WTF is the front office doing .  Horrible trade "
86,A perspective on this Spurs season.,"Bottom Line Up Front: The Tank is over, but the rebuild rolls on. 

Coming out of the draft, there was a lot of talk about this team trying to compete right away. ""Trade the picks! Go get Dame! Grab Austin Reeves/Fred VanVleet! etc.""  Nothing happened. Next was the Spurs remaining active in off-season trades grabbing big player salaries for assets. Then they waived 3 of the 4 players they traded for.  

Only a few players who are expected to make the roster over 25 years old, the takeaways from media day and the first day of camp are they all believe that it's winning time in San Antonio. I expect confidence and bravado out of any player about winning, but now we hear it from the coach too. It's a different feeling than Pop telling the world to not to bet on the team to win the championship last year, but at the same time. The team is ready to perform and start winning. 

On the other hand, the front office still has their eyes on the future. With upwards of 11 1st round picks over the next 5 years, Brian Wright see's no need to rush. The team has multiple bites at the draft apple and the team is going to look very different in the next 3-5 years, save for maybe 2 or 3 guys. Also, it allows for cap flexibility and trade capital that can benefit the Spurs as a small market team with a superstar they want to keep around (see G. Antetokounmpo). A home grown core lasts much longer than expensive free agents. There's no reason to spend that capital before they know what they have. 

So to wrap up, this team will try to win every game all season. There won't be extensive stints on the injured list when not really needed and there won't be experimenting with G-Leaguers down the stretch to 'see what they have in a guy.' But there will probably still be more Ls than Ws. I don't think this means they can't compete for a playoff spot or at least a shot at the play-in tourney, however in a loaded Western Conference where 12-13 teams are going for it this year, win's will be hard. The only guarantee is this season will be a lot more fun than last year. 

Thoughts? Am I way off base? Did I miss an obvious thread that could change everything? Is this the most exciting pre-season since the start of the '17-'18 season when Kawhi was going to come back from injury and exact revenge on Zaza and the Warriors?

/endrant

//gsg"
87,Listen here...,
88,Your opinion on this statement: The Spurs have the least talented roster in the league outside the Detroit Pistons.,"Your opinion on this statement: The Spurs have the least talented roster in the league outside the Detroit Pistons.

[View Poll](https://www.reddit.com/poll/18segkq)"
